{
  "schema": 1,
  "task_id": "task-fixture-v06-001",
  "mission_id": "mission-fixture-v06-001",
  "title": "Inspect bounded source",
  "objective": "Read one bounded fixture and preserve evidence without external writes.",
  "employee_id": "alex",
  "risk_class": "READ_ONLY",
  "state": "READY",
  "approval": {
    "required": false,
    "status": "NOT_REQUIRED",
    "approval_ref": null
  },
  "attempt_ids": [],
  "evidence_refs": [],
  "receipt_refs": [],
  "blocking": null,
  "legacy": null,
  "created_at": "2026-10-01T05:20:00.000Z",
  "updated_at": "2026-10-01T05:20:00.000Z"
}
